GEO.id,GEO.id2,GEO.display-label,HC01_EST_VC01,HC01_MOE_VC01,HC02_EST_VC01,HC02_MOE_VC01,HC03_EST_VC01,HC03_MOE_VC01,HC04_EST_VC01,HC04_MOE_VC01,HC05_EST_VC01,HC05_MOE_VC01,HC06_EST_VC01,HC06_MOE_VC01,HC01_EST_VC02,HC01_MOE_VC02,HC02_EST_VC02,HC02_MOE_VC02,HC03_EST_VC02,HC03_MOE_VC02,HC04_EST_VC02,HC04_MOE_VC02,HC05_EST_VC02,HC05_MOE_VC02,HC06_EST_VC02,HC06_MOE_VC02,HC01_EST_VC03,HC01_MOE_VC03,HC02_EST_VC03,HC02_MOE_VC03,HC03_EST_VC03,HC03_MOE_VC03,HC04_EST_VC03,HC04_MOE_VC03,HC05_EST_VC03,HC05_MOE_VC03,HC06_EST_VC03,HC06_MOE_VC03,HC01_EST_VC04,HC01_MOE_VC04,HC02_EST_VC04,HC02_MOE_VC04,HC03_EST_VC04,HC03_MOE_VC04,HC04_EST_VC04,HC04_MOE_VC04,HC05_EST_VC04,HC05_MOE_VC04,HC06_EST_VC04,HC06_MOE_VC04,HC01_EST_VC05,HC01_MOE_VC05,HC02_EST_VC05,HC02_MOE_VC05,HC03_EST_VC05,HC03_MOE_VC05,HC04_EST_VC05,HC04_MOE_VC05,HC05_EST_VC05,HC05_MOE_VC05,HC06_EST_VC05,HC06_MOE_VC05,HC01_EST_VC06,HC01_MOE_VC06,HC02_EST_VC06,HC02_MOE_VC06,HC03_EST_VC06,HC03_MOE_VC06,HC04_EST_VC06,HC04_MOE_VC06,HC05_EST_VC06,HC05_MOE_VC06,HC06_EST_VC06,HC06_MOE_VC06,HC01_EST_VC09,HC01_MOE_VC09,HC02_EST_VC09,HC02_MOE_VC09,HC03_EST_VC09,HC03_MOE_VC09,HC04_EST_VC09,HC04_MOE_VC09,HC05_EST_VC09,HC05_MOE_VC09,HC06_EST_VC09,HC06_MOE_VC09
Id,Id2,Geography,Total; Estimate; Civilian employed population 16 years and over,Total; Margin of Error; Civilian employed population 16 years and over,Employee of private company workers; Estimate; Civilian employed population 16 years and over,Employee of private company workers; Margin of Error; Civilian employed population 16 years and over,Self-employed in own incorporated business workers; Estimate; Civilian employed population 16 years and over,Self-employed in own incorporated business workers; Margin of Error; Civilian employed population 16 years and over,Private not-for-profit wage and salary workers; Estimate; Civilian employed population 16 years and over,Private not-for-profit wage and salary workers; Margin of Error; Civilian employed population 16 years and over,"Local, state, and federal government workers; Estimate; Civilian employed population 16 years and over","Local, state, and federal government workers; Margin of Error; Civilian employed population 16 years and over",Self-employed in own not incorporated business workers and unpaid family workers; Estimate; Civilian employed population 16 years and over,Self-employed in own not incorporated business workers and unpaid family workers; Margin of Error; Civilian employed population 16 years and over,"Total; Estimate; Management, business, science, and arts occupations","Total; Margin of Error; Management, business, science, and arts occupations","Employee of private company workers; Estimate; Management, business, science, and arts occupations","Employee of private company workers; Margin of Error; Management, business, science, and arts occupations","Self-employed in own incorporated business workers; Estimate; Management, business, science, and arts occupations","Self-employed in own incorporated business workers; Margin of Error; Management, business, science, and arts occupations","Private not-for-profit wage and salary workers; Estimate; Management, business, science, and arts occupations","Private not-for-profit wage and salary workers; Margin of Error; Management, business, science, and arts occupations","Local, state, and federal government workers; Estimate; Management, business, science, and arts occupations","Local, state, and federal government workers; Margin of Error; Management, business, science, and arts occupations","Self-employed in own not incorporated business workers and unpaid family workers; Estimate; Management, business, science, and arts occupations","Self-employed in own not incorporated business workers and unpaid family workers; Margin of Error; Management, business, science, and arts occupations",Total; Estimate; Service occupations,Total; Margin of Error; Service occupations,Employee of private company workers; Estimate; Service occupations,Employee of private company workers; Margin of Error; Service occupations,Self-employed in own incorporated business workers; Estimate; Service occupations,Self-employed in own incorporated business workers; Margin of Error; Service occupations,Private not-for-profit wage and salary workers; Estimate; Service occupations,Private not-for-profit wage and salary workers; Margin of Error; Service occupations,"Local, state, and federal government workers; Estimate; Service occupations","Local, state, and federal government workers; Margin of Error; Service occupations",Self-employed in own not incorporated business workers and unpaid family workers; Estimate; Service occupations,Self-employed in own not incorporated business workers and unpaid family workers; Margin of Error; Service occupations,Total; Estimate; Sales and office occupations,Total; Margin of Error; Sales and office occupations,Employee of private company workers; Estimate; Sales and office occupations,Employee of private company workers; Margin of Error; Sales and office occupations,Self-employed in own incorporated business workers; Estimate; Sales and office occupations,Self-employed in own incorporated business workers; Margin of Error; Sales and office occupations,Private not-for-profit wage and salary workers; Estimate; Sales and office occupations,Private not-for-profit wage and salary workers; Margin of Error; Sales and office occupations,"Local, state, and federal government workers; Estimate; Sales and office occupations","Local, state, and federal government workers; Margin of Error; Sales and office occupations",Self-employed in own not incorporated business workers and unpaid family workers; Estimate; Sales and office occupations,Self-employed in own not incorporated business workers and unpaid family workers; Margin of Error; Sales and office occupations,"Total; Estimate; Natural resources, construction, and maintenance occupations","Total; Margin of Error; Natural resources, construction, and maintenance occupations","Employee of private company workers; Estimate; Natural resources, construction, and maintenance occupations","Employee of private company workers; Margin of Error; Natural resources, construction, and maintenance occupations","Self-employed in own incorporated business workers; Estimate; Natural resources, construction, and maintenance occupations","Self-employed in own incorporated business workers; Margin of Error; Natural resources, construction, and maintenance occupations","Private not-for-profit wage and salary workers; Estimate; Natural resources, construction, and maintenance occupations","Private not-for-profit wage and salary workers; Margin of Error; Natural resources, construction, and maintenance occupations","Local, state, and federal government workers; Estimate; Natural resources, construction, and maintenance occupations","Local, state, and federal government workers; Margin of Error; Natural resources, construction, and maintenance occupations","Self-employed in own not incorporated business workers and unpaid family workers; Estimate; Natural resources, construction, and maintenance occupations","Self-employed in own not incorporated business workers and unpaid family workers; Margin of Error; Natural resources, construction, and maintenance occupations","Total; Estimate; Production, transportation, and material moving occupations","Total; Margin of Error; Production, transportation, and material moving occupations","Employee of private company workers; Estimate; Production, transportation, and material moving occupations","Employee of private company workers; Margin of Error; Production, transportation, and material moving occupations","Self-employed in own incorporated business workers; Estimate; Production, transportation, and material moving occupations","Self-employed in own incorporated business workers; Margin of Error; Production, transportation, and material moving occupations","Private not-for-profit wage and salary workers; Estimate; Production, transportation, and material moving occupations","Private not-for-profit wage and salary workers; Margin of Error; Production, transportation, and material moving occupations","Local, state, and federal government workers; Estimate; Production, transportation, and material moving occupations","Local, state, and federal government workers; Margin of Error; Production, transportation, and material moving occupations","Self-employed in own not incorporated business workers and unpaid family workers; Estimate; Production, transportation, and material moving occupations","Self-employed in own not incorporated business workers and unpaid family workers; Margin of Error; Production, transportation, and material moving occupations",Total; Estimate; PERCENT IMPUTED - Occupation,Total; Margin of Error; PERCENT IMPUTED - Occupation,Employee of private company workers; Estimate; PERCENT IMPUTED - Occupation,Employee of private company workers; Margin of Error; PERCENT IMPUTED - Occupation,Self-employed in own incorporated business workers; Estimate; PERCENT IMPUTED - Occupation,Self-employed in own incorporated business workers; Margin of Error; PERCENT IMPUTED - Occupation,Private not-for-profit wage and salary workers; Estimate; PERCENT IMPUTED - Occupation,Private not-for-profit wage and salary workers; Margin of Error; PERCENT IMPUTED - Occupation,"Local, state, and federal government workers; Estimate; PERCENT IMPUTED - Occupation","Local, state, and federal government workers; Margin of Error; PERCENT IMPUTED - Occupation",Self-employed in own not incorporated business workers and unpaid family workers; Estimate; PERCENT IMPUTED - Occupation,Self-employed in own not incorporated business workers and unpaid family workers; Margin of Error; PERCENT IMPUTED - Occupation
0400000US09,09,Connecticut,1762707,5695,66.4,0.2,3.5,0.1,9.8,0.2,13.6,0.2,6.7,0.1,721154,5101,55.5,0.4,4.4,0.2,15.0,0.3,19.0,0.3,6.1,0.2,306242,3937,64.2,0.6,2.0,0.2,9.2,0.4,15.4,0.5,9.1,0.3,428801,4273,77.4,0.4,3.2,0.2,6.5,0.3,8.7,0.3,4.2,0.2,133336,2480,67.1,1.0,5.6,0.4,3.2,0.4,7.2,0.6,16.9,0.7,173174,3402,87.5,0.6,1.5,0.2,3.2,0.3,4.6,0.4,3.1,0.3,6.0,(X),(X),(X),(X),(X),(X),(X),(X),(X),(X),(X)
0500000US09001,09001,"Fairfield County, Connecticut",445341,2656,68.1,0.5,4.8,0.2,8.4,0.3,10.0,0.3,8.7,0.3,194476,2272,60.4,0.8,6.1,0.3,12.2,0.5,13.4,0.5,7.9,0.4,74456,2058,65.5,1.4,2.8,0.4,7.1,0.6,11.5,1.0,13.1,0.9,109603,1999,79.3,0.9,3.7,0.4,5.9,0.5,6.3,0.5,4.8,0.4,34571,1429,64.1,2.1,7.6,1.1,2.2,0.6,5.4,0.9,20.6,1.7,32235,1379,86.7,1.3,2.2,0.5,2.9,0.7,4.0,0.7,4.2,0.7,6.5,(X),(X),(X),(X),(X),(X),(X),(X),(X),(X),(X)
0500000US09003,09003,"Hartford County, Connecticut",436599,2520,67.8,0.6,3.0,0.2,9.5,0.2,14.4,0.4,5.4,0.3,179779,2399,57.4,0.8,3.5,0.3,13.8,0.5,20.7,0.6,4.7,0.3,74721,1682,65.5,1.2,2.0,0.4,10.0,0.7,15.3,1.0,7.2,0.7,109581,1958,77.1,0.9,3.0,0.4,6.2,0.6,9.6,0.6,4.2,0.4,27083,1088,71.8,1.9,4.9,0.8,3.0,0.7,6.1,1.0,14.1,1.5,45435,1407,88.3,1.1,1.3,0.4,3.3,0.5,4.5,0.7,2.6,0.6,5.9,(X),(X),(X),(X),(X),(X),(X),(X),(X),(X),(X)
0500000US09005,09005,"Litchfield County, Connecticut",99771,921,62.6,1.1,4.2,0.4,10.2,0.7,12.9,0.7,9.9,0.7,39336,1068,51.1,1.8,5.3,0.7,16.1,1.3,19.1,1.3,8.4,0.7,16668,790,57.7,2.6,2.6,0.8,9.3,1.4,15.2,2.2,15.2,2.1,23239,902,75.9,1.8,3.3,0.7,7.9,1.2,8.1,1.0,4.7,0.8,9960,657,58.2,3.3,7.6,1.6,2.6,1.1,6.5,1.4,25.1,3.6,10568,689,88.4,2.2,2.0,0.8,2.0,0.9,3.0,0.9,4.5,1.4,5.6,(X),(X),(X),(X),(X),(X),(X),(X),(X),(X),(X)
0500000US09007,09007,"Middlesex County, Connecticut",86553,1038,65.4,1.3,3.8,0.5,9.1,0.7,14.6,0.8,7.0,0.6,39047,1045,55.7,1.7,4.2,0.7,13.9,1.0,20.3,1.3,5.9,0.8,12825,704,65.5,3.2,1.9,0.9,6.5,1.5,16.7,2.4,9.4,1.8,20380,744,76.4,1.8,4.1,1.1,6.2,1.1,8.5,1.1,4.8,1.1,6671,457,65.8,3.9,5.3,1.7,2.6,1.2,7.8,2.0,18.5,3.3,7630,579,85.4,3.0,3.1,1.2,2.6,1.2,4.2,1.7,4.8,1.8,4.4,(X),(X),(X),(X),(X),(X),(X),(X),(X),(X),(X)
0500000US09009,09009,"New Haven County, Connecticut",422381,2867,65.3,0.5,2.9,0.2,12.6,0.4,13.6,0.4,5.6,0.3,166752,2458,51.5,0.8,3.7,0.4,20.1,0.8,19.5,0.6,5.3,0.4,73184,2021,62.7,1.4,1.8,0.4,11.8,1.1,16.4,1.0,7.3,0.8,103324,2168,77.4,0.8,3.0,0.4,7.7,0.5,8.2,0.6,3.7,0.4,31024,1319,69.9,2.2,4.5,0.7,4.2,0.9,7.1,1.0,14.2,1.5,48097,1613,87.8,1.2,1.0,0.3,4.0,0.7,4.5,0.7,2.7,0.5,6.4,(X),(X),(X),(X),(X),(X),(X),(X),(X),(X),(X)
0500000US09011,09011,"New London County, Connecticut",133476,1291,67.3,0.9,2.7,0.3,8.8,0.5,15.4,0.7,5.9,0.5,49902,1384,54.6,1.6,3.7,0.4,14.5,1.0,21.1,1.2,6.1,0.8,30176,1186,70.2,2.1,0.9,0.4,6.9,1.0,16.3,1.8,5.5,0.9,29889,1035,77.3,1.5,3.1,0.7,5.7,1.0,10.3,1.2,3.6,0.7,11115,708,67.0,3.6,3.5,1.0,3.3,1.2,11.1,2.6,15.1,2.6,12394,809,87.1,1.8,0.7,0.4,3.1,1.0,6.1,1.5,3.0,0.9,5.1,(X),(X),(X),(X),(X),(X),(X),(X),(X),(X),(X)
0500000US09013,09013,"Tolland County, Connecticut",80405,1027,61.9,1.3,2.6,0.4,7.5,0.7,21.9,1.3,6.1,0.7,34390,1006,49.7,2.0,3.5,0.7,11.7,1.3,29.9,2.0,5.2,0.9,12337,779,58.0,3.3,1.8,1.0,6.5,1.5,24.0,3.0,9.7,2.1,18903,952,73.8,2.3,2.4,0.7,4.4,0.9,15.8,2.0,3.6,0.9,6981,545,68.0,3.9,3.3,1.3,3.3,1.6,11.2,3.0,14.2,2.5,7794,636,87.5,2.8,0.4,0.4,1.8,1.1,7.8,2.3,2.6,1.3,5.8,(X),(X),(X),(X),(X),(X),(X),(X),(X),(X),(X)
0500000US09015,09015,"Windham County, Connecticut",58181,1018,63.0,1.4,2.8,0.5,10.0,0.8,18.1,1.0,6.1,0.7,17472,844,45.0,2.6,3.5,1.0,16.6,1.8,28.6,2.0,6.2,1.1,11875,773,56.7,3.3,1.8,0.8,12.3,2.0,22.2,2.9,7.0,1.6,13882,710,74.8,2.2,1.8,0.7,6.9,1.3,11.7,1.6,4.7,1.3,5931,510,64.4,5.0,5.5,2.2,4.9,3.9,12.0,3.2,13.3,3.0,9021,715,86.9,2.4,2.5,1.5,2.6,1.2,6.0,2.0,2.0,0.8,3.6,(X),(X),(X),(X),(X),(X),(X),(X),(X),(X),(X)
0600000US0900100000,0900100000,"County subdivisions not defined, Fairfield County, Connecticut",0,12,-,**,-,**,-,**,-,**,-,**,0,12,-,**,-,**,-,**,-,**,-,**,0,12,-,**,-,**,-,**,-,**,-,**,0,12,-,**,-,**,-,**,-,**,-,**,0,12,-,**,-,**,-,**,-,**,-,**,0,12,-,**,-,**,-,**,-,**,-,**,-,(X),(X),(X),(X),(X),(X),(X),(X),(X),(X),(X)
0600000US0900104720,0900104720,"Bethel town, Fairfield County, Connecticut",9878,332,65.3,3.3,4.2,1.3,8.8,1.7,13.6,2.1,8.1,1.9,4499,390,56.6,4.8,2.9,1.6,11.9,2.6,19.1,3.6,9.5,3.3,1288,234,51.0,7.8,6.2,3.5,15.8,7.8,12.6,5.5,14.4,5.8,2540,263,79.9,4.3,5.4,2.9,4.9,2.3,8.0,2.8,1.8,1.2,760,189,67.0,11.4,6.8,5.6,0.0,4.5,10.7,9.0,15.5,6.2,791,177,89.4,5.6,2.1,2.5,0.6,1.2,5.3,4.4,2.5,2.9,3.6,(X),(X),(X),(X),(X),(X),(X),(X),(X),(X),(X)
0600000US0900108070,0900108070,"Bridgeport town, Fairfield County, Connecticut",62825,1358,72.7,1.4,1.8,0.4,9.9,1.0,10.0,0.9,5.6,0.9,14537,926,55.2,3.2,2.1,0.9,19.2,2.2,19.1,2.6,4.3,1.4,16989,977,70.8,2.7,1.1,0.5,9.9,1.7,10.7,1.8,7.5,1.6,15903,858,81.6,2.1,1.1,0.5,7.3,1.5,7.5,1.5,2.4,1.0,6578,679,70.6,5.5,6.1,2.4,4.0,1.7,3.4,1.3,16.0,5.1,8818,639,90.9,2.5,0.8,0.6,3.5,1.4,3.0,1.4,1.7,1.2,8.6,(X),(X),(X),(X),(X),(X),(X),(X),(X),(X),(X)
0600000US0900108980,0900108980,"Brookfield town, Fairfield County, Connecticut",9036,383,65.8,2.9,8.9,2.7,6.2,1.6,10.9,1.9,8.3,1.7,4378,330,61.2,5.0,9.4,3.4,8.8,3.1,14.5,3.1,6.1,2.5,1071,229,71.7,10.8,2.4,2.9,4.6,4.4,9.7,6.1,11.6,7.1,2422,294,75.8,6.0,10.7,5.5,3.8,2.5,5.0,2.9,4.7,2.3,683,179,35.4,10.0,15.2,9.7,4.7,7.1,11.6,11.0,33.1,14.8,482,150,86.5,10.5,0.0,7.0,0.0,7.0,10.2,9.3,3.3,5.2,7.0,(X),(X),(X),(X),(X),(X),(X),(X),(X),(X),(X)
0600000US0900118500,0900118500,"Danbury town, Fairfield County, Connecticut",44813,929,71.8,2.0,2.1,0.5,7.4,1.2,10.0,0.9,8.7,1.2,14271,853,58.9,3.8,2.0,0.8,13.6,2.4,18.3,2.2,7.2,1.9,10009,809,68.1,4.2,1.8,1.0,5.5,2.1,8.3,1.8,16.3,3.1,10406,627,82.2,2.6,2.7,1.1,6.2,1.9,6.3,1.6,2.6,1.0,5130,599,73.8,4.8,3.4,1.7,1.9,1.7,4.5,1.8,16.5,4.1,4997,594,92.4,2.4,0.8,0.9,1.7,1.3,3.0,1.3,2.2,1.5,7.3,(X),(X),(X),(X),(X),(X),(X),(X),(X),(X),(X)
0600000US0900118850,0900118850,"Darien town, Fairfield County, Connecticut",7673,385,71.0,2.9,5.2,1.5,8.3,1.7,5.8,1.5,9.7,2.0,5105,297,67.3,3.4,5.7,1.7,10.1,2.2,8.0,2.0,9.0,2.3,286,103,72.0,14.8,0.0,11.5,8.7,8.4,8.0,7.7,11.2,10.9,1929,226,81.2,5.5,3.9,2.4,4.5,3.1,0.5,0.8,9.9,3.9,209,87,54.5,21.3,14.8,15.0,0.0,15.4,0.0,15.4,30.6,21.7,144,85,86.8,14.6,0.0,21.4,8.3,12.2,4.9,8.4,0.0,21.4,2.9,(X),(X),(X),(X),(X),(X),(X),(X),(X),(X),(X)
0600000US0900123890,0900123890,"Easton town, Fairfield County, Connecticut",3580,194,62.9,4.8,10.2,3.0,5.8,2.3,10.9,3.2,10.1,2.4,2217,217,60.1,6.0,10.3,4.0,6.3,2.6,13.2,4.4,10.1,3.0,244,99,67.2,15.6,11.9,11.2,5.3,7.3,0.0,13.3,15.6,12.6,827,144,68.2,10.0,8.5,5.1,6.8,5.1,7.7,6.9,8.8,4.0,139,66,50.4,19.0,20.9,13.4,0.0,22.0,9.4,11.3,19.4,16.2,153,68,79.7,18.7,5.9,8.8,0.0,20.3,14.4,16.1,0.0,20.3,8.4,(X),(X),(X),(X),(X),(X),(X),(X),(X),(X),(X)
0600000US0900126620,0900126620,"Fairfield town, Fairfield County, Connecticut",27699,618,64.0,1.7,6.2,0.9,9.3,1.2,11.2,1.2,9.3,1.2,15045,596,58.9,2.3,7.7,1.5,12.6,1.8,11.5,1.5,9.3,1.5,3076,343,54.5,6.7,3.3,3.6,6.6,2.3,21.6,5.6,14.1,4.9,7290,425,78.4,2.5,4.2,1.4,6.0,1.8,6.4,1.3,5.0,1.4,1276,228,53.4,9.7,9.6,5.2,0.7,1.2,13.4,9.2,22.9,8.5,1012,203,78.7,7.0,3.0,2.8,3.0,2.7,6.9,5.8,8.5,5.0,5.8,(X),(X),(X),(X),(X),(X),(X),(X),(X),(X),(X)
0600000US0900133620,0900133620,"Greenwich town, Fairfield County, Connecticut",27193,698,65.4,2.1,8.7,1.1,7.6,1.0,8.6,1.1,9.6,1.0,15017,585,61.0,2.6,10.2,1.5,10.0,1.4,8.7,1.5,10.1,1.5,3524,391,62.0,6.3,7.3,3.9,4.0,2.1,15.7,5.2,11.0,3.3,6558,510,77.4,3.4,5.2,1.8,5.4,1.7,5.3,1.6,6.7,1.9,1107,203,55.7,9.4,16.8,7.9,1.7,3.0,5.8,4.0,20.0,7.2,987,223,75.3,8.5,5.3,3.9,5.6,4.6,7.6,5.0,6.3,5.2,4.4,(X),(X),(X),(X),(X),(X),(X),(X),(X),(X),(X)
0600000US0900148620,0900148620,"Monroe town, Fairfield County, Connecticut",9845,397,63.5,3.4,5.3,1.6,9.0,2.3,15.4,2.7,6.7,1.9,5118,379,57.7,4.7,6.4,2.4,12.0,3.2,18.3,3.9,5.5,2.1,1181,240,59.6,12.0,1.5,2.2,1.2,1.9,31.4,11.6,6.3,5.2,2470,352,74.0,6.8,4.9,2.6,10.1,5.0,6.9,3.6,4.0,3.5,721,183,67.4,12.0,3.3,3.9,0.0,4.7,4.6,5.4,24.7,11.0,355,122,78.9,13.2,8.7,9.4,3.9,6.5,2.0,5.1,6.5,7.4,6.1,(X),(X),(X),(X),(X),(X),(X),(X),(X),(X),(X)
0600000US0900150580,0900150580,"New Canaan town, Fairfield County, Connecticut",7766,372,64.1,3.4,9.8,1.9,8.5,2.2,7.5,1.7,10.2,2.2,4676,401,58.1,3.9,10.9,2.8,10.8,3.1,9.0,2.5,11.2,3.1,557,168,63.0,12.6,6.3,5.9,9.0,8.7,7.7,6.6,14.0,8.8,2123,273,78.2,6.1,7.0,3.7,4.0,2.8,5.0,3.3,5.8,2.6,223,100,53.8,22.9,28.3,16.5,0.0,14.5,5.8,8.9,12.1,15.2,187,116,70.1,26.6,0.0,17.0,10.7,12.7,0.0,17.0,19.3,23.4,4.7,(X),(X),(X),(X),(X),(X),(X),(X),(X),(X),(X)
0600000US0900150860,0900150860,"New Fairfield town, Fairfield County, Connecticut",6943,247,66.5,3.4,4.3,1.5,8.9,2.0,12.2,2.1,8.1,1.9,2991,248,60.2,4.9,3.6,1.6,15.0,3.5,13.8,3.3,7.3,2.7,819,156,66.7,11.3,9.2,7.1,2.3,2.7,18.9,9.0,2.9,2.8,2208,262,76.6,5.7,3.4,2.1,6.3,3.0,7.3,3.5,6.4,3.5,568,141,58.1,12.6,5.3,4.2,0.0,6.0,12.1,8.1,24.5,10.6,357,102,68.6,14.5,2.8,4.2,4.2,5.5,13.4,10.9,10.9,11.5,4.1,(X),(X),(X),(X),(X),(X),(X),(X),(X),(X),(X)
0600000US0900152980,0900152980,"Newtown town, Fairfield County, Connecticut",13407,421,64.0,2.2,6.9,1.3,6.2,1.2,14.2,1.7,8.7,1.4,7101,358,57.0,3.2,6.7,1.7,9.0,1.7,18.6,2.5,8.6,1.9,1419,228,65.4,7.9,4.7,2.5,5.9,3.6,19.2,7.5,4.8,2.9,3255,300,79.7,5.4,4.4,2.1,3.2,2.3,6.3,3.0,6.4,2.6,913,164,53.9,10.6,15.8,7.8,0.0,3.8,6.0,5.0,24.3,9.6,719,153,71.3,11.3,13.1,10.2,0.4,0.9,6.7,6.2,8.5,4.8,4.4,(X),(X),(X),(X),(X),(X),(X),(X),(X),(X),(X)
0600000US0900156060,0900156060,"Norwalk town, Fairfield County, Connecticut",47287,1066,71.0,1.6,3.5,0.6,7.5,0.9,8.5,1.0,9.6,1.0,19031,885,66.2,2.4,3.0,0.7,11.9,1.4,12.1,1.7,6.8,1.1,8397,860,63.7,4.6,4.3,1.7,5.9,2.1,8.7,2.6,17.4,3.5,12516,856,82.6,2.6,2.8,0.9,4.8,1.4,5.3,1.8,4.5,1.1,4836,554,65.3,5.8,6.2,2.9,2.8,1.9,3.6,1.8,22.0,5.1,2507,350,84.5,5.4,2.1,1.7,2.7,2.2,4.8,3.1,5.9,3.6,8.7,(X),(X),(X),(X),(X),(X),(X),(X),(X),(X),(X)
0600000US0900163480,0900163480,"Redding town, Fairfield County, Connecticut",4324,231,56.8,4.1,6.5,2.1,10.9,2.8,13.3,3.1,12.4,3.0,2611,263,55.6,5.8,5.9,2.7,14.3,4.3,14.8,3.4,9.4,3.6,476,127,43.3,13.3,1.9,3.5,3.8,4.2,29.6,14.4,21.4,10.4,890,163,71.5,8.1,10.6,6.8,6.7,4.3,4.4,5.2,6.9,4.5,233,67,33.5,14.7,11.2,10.4,8.6,10.6,0.0,13.9,46.8,21.2,114,51,73.7,20.7,0.0,26.0,0.0,26.0,8.8,12.9,17.5,18.9,3.2,(X),(X),(X),(X),(X),(X),(X),(X),(X),(X),(X)
0600000US0900163970,0900163970,"Ridgefield town, Fairfield County, Connecticut",11021,379,63.9,2.5,7.2,1.5,9.7,1.7,9.0,1.5,10.1,1.7,6902,381,60.4,3.5,6.0,1.7,11.4,2.1,10.8,2.3,11.4,2.3,745,153,48.5,11.9,9.1,6.2,10.6,6.6,10.9,5.7,20.9,10.4,2532,275,75.7,4.8,7.8,3.7,8.1,3.5,4.0,1.8,4.4,1.9,428,141,62.1,15.5,22.0,10.7,0.0,7.8,5.1,5.7,10.7,11.8,414,193,80.4,11.6,4.6,5.2,0.0,8.1,11.6,9.8,3.4,5.6,4.5,(X),(X),(X),(X),(X),(X),(X),(X),(X),(X),(X)
0600000US0900168170,0900168170,"Shelton town, Fairfield County, Connecticut",20118,527,68.6,2.3,3.3,0.8,7.8,1.3,13.5,2.0,6.8,1.2,8646,577,61.6,3.2,3.4,1.2,12.9,2.4,16.5,2.8,5.5,1.7,2534,315,62.6,6.1,3.6,2.8,4.2,2.3,20.6,5.6,9.0,4.4,5456,492,77.6,3.5,2.3,1.2,4.8,2.1,9.1,2.8,6.1,2.0,1754,279,68.1,8.6,6.4,3.4,2.6,2.5,8.3,4.6,14.7,6.1,1728,307,83.9,4.5,2.2,2.4,2.0,1.6,7.5,3.9,4.4,2.6,5.0,(X),(X),(X),(X),(X),(X),(X),(X),(X),(X),(X)
0600000US0900168310,0900168310,"Sherman town, Fairfield County, Connecticut",1834,142,60.6,6.9,6.7,2.9,12.2,5.3,9.8,3.4,10.7,3.8,929,135,55.9,8.8,8.4,5.1,18.9,8.4,13.5,5.0,3.3,2.5,251,88,40.6,17.9,4.0,6.0,10.4,9.6,13.9,16.7,31.1,20.0,411,100,86.9,9.1,3.6,3.9,0.0,8.2,2.7,4.2,6.8,6.7,87,49,44.8,23.4,11.5,17.6,13.8,18.6,0.0,31.9,29.9,23.1,156,63,60.9,17.8,6.4,9.7,5.8,9.4,5.8,8.7,21.2,16.9,8.6,(X),(X),(X),(X),(X),(X),(X),(X),(X),(X),(X)
0600000US0900173070,0900173070,"Stamford town, Fairfield County, Connecticut",63428,1203,70.6,1.4,4.2,0.6,7.5,0.7,7.6,0.8,10.0,1.1,26478,1002,66.6,1.9,5.7,0.9,11.3,1.2,10.4,1.4,6.0,1.1,13932,878,67.5,3.1,2.0,0.7,6.2,1.4,6.4,1.5,17.9,3.0,13631,793,80.4,2.6,3.2,0.9,6.0,1.6,5.7,1.4,4.7,1.3,5163,638,57.9,5.9,7.8,3.4,0.9,0.8,6.2,2.4,27.2,5.9,4224,571,90.5,3.4,1.5,1.2,1.4,1.6,2.3,1.5,4.3,2.4,7.9,(X),(X),(X),(X),(X),(X),(X),(X),(X),(X),(X)
0600000US0900174190,0900174190,"Stratford town, Fairfield County, Connecticut",25760,617,68.0,2.0,3.1,0.7,9.8,1.5,12.4,1.3,6.8,1.0,9894,642,56.5,3.4,3.4,1.1,15.6,2.5,18.4,2.2,6.1,1.5,4282,487,66.7,6.0,2.1,1.3,9.4,4.0,14.8,4.7,7.0,2.2,6671,528,78.1,3.5,1.9,1.0,6.3,2.0,9.0,2.6,4.7,1.6,2087,365,67.7,7.0,7.6,3.6,0.5,0.6,4.3,2.6,19.9,6.5,2826,375,86.4,5.0,3.0,2.1,4.9,4.0,1.2,1.2,4.4,2.5,4.0,(X),(X),(X),(X),(X),(X),(X),(X),(X),(X),(X)
0600000US0900177200,0900177200,"Trumbull town, Fairfield County, Connecticut",16976,535,63.4,2.4,6.1,1.2,10.5,1.8,12.7,1.6,7.3,1.3,9392,549,57.1,3.5,7.0,1.7,13.3,2.6,15.7,2.4,6.9,1.8,1688,298,61.2,7.8,2.4,1.8,7.3,3.5,19.5,6.3,9.7,4.1,4170,419,76.8,4.1,4.6,1.8,7.0,2.3,6.5,2.4,5.1,2.2,953,223,61.3,11.4,10.2,6.0,7.5,6.6,4.0,4.0,17.1,7.7,773,125,74.4,9.5,6.5,5.7,6.3,4.2,6.1,5.2,6.7,4.8,5.6,(X),(X),(X),(X),(X),(X),(X),(X),(X),(X),(X)
0600000US0900183430,0900183430,"Weston town, Fairfield County, Connecticut",4347,249,62.3,3.4,11.4,2.4,6.1,1.8,7.3,2.4,12.9,3.0,2985,230,56.8,5.1,13.5,3.0,8.1,2.5,7.6,2.6,14.1,4.5,256,102,62.5,18.1,2.7,4.9,4.3,7.5,16.8,17.9,13.7,11.4,845,156,83.2,7.2,6.4,3.6,0.0,4.1,5.6,5.4,4.9,3.8,172,85,50.6,27.4,16.9,15.3,0.0,18.3,0.0,18.3,32.6,22.1,89,50,73.0,23.4,5.6,10.5,11.2,18.0,0.0,31.4,10.1,16.1,4.6,(X),(X),(X),(X),(X),(X),(X),(X),(X),(X),(X)
0600000US0900183500,0900183500,"Westport town, Fairfield County, Connecticut",11437,419,56.7,2.6,12.7,2.1,7.2,1.3,7.1,1.4,16.3,1.9,7550,441,54.7,3.1,15.3,2.9,8.3,1.6,8.0,1.8,13.7,2.2,869,155,46.3,12.2,3.7,3.5,4.4,3.8,9.4,5.0,36.2,12.8,2557,291,67.5,5.1,9.0,3.9,5.9,3.2,4.1,3.1,13.5,3.8,276,122,50.7,20.0,2.9,4.6,0.0,11.9,6.2,9.4,40.2,19.0,185,88,47.0,24.9,13.5,15.0,5.9,10.2,0.0,17.2,33.5,29.7,4.1,(X),(X),(X),(X),(X),(X),(X),(X),(X),(X),(X)
0600000US0900186370,0900186370,"Wilton town, Fairfield County, Connecticut",8151,313,64.1,3.0,7.7,1.8,9.0,1.7,8.7,2.0,10.5,1.9,5103,301,59.8,4.2,9.0,2.4,10.1,2.4,10.3,2.9,10.8,2.5,563,112,54.0,10.2,2.0,3.2,20.8,8.7,8.7,5.6,14.6,8.5,1993,230,78.8,4.6,6.3,2.7,4.4,2.2,3.8,3.7,6.8,2.8,275,109,46.5,18.7,12.7,10.0,0.0,11.9,17.1,17.1,23.6,14.0,217,83,79.3,13.8,0.9,2.5,7.4,8.6,3.7,5.9,8.8,9.8,5.3,(X),(X),(X),(X),(X),(X),(X),(X),(X),(X),(X)
0600000US0900302060,0900302060,"Avon town, Hartford County, Connecticut",8693,393,67.1,3.5,5.4,1.5,8.0,1.8,11.0,2.2,8.6,2.1,5642,346,63.3,4.1,5.6,2.1,10.0,2.4,13.3,2.8,7.8,2.4,639,154,70.7,10.5,0.0,5.3,12.1,9.3,13.1,7.3,4.1,5.4,1846,231,74.3,6.4,7.3,3.3,2.8,2.2,3.5,2.3,12.1,6.1,255,97,65.9,18.1,7.5,8.1,0.0,12.8,16.9,14.2,9.8,11.2,311,126,86.5,10.5,0.0,10.6,0.0,10.6,3.2,5.6,10.3,8.5,3.4,(X),(X),(X),(X),(X),(X),(X),(X),(X),(X),(X)
0600000US0900304300,0900304300,"Berlin town, Hartford County, Connecticut",10816,364,60.3,4.0,3.7,1.4,8.5,2.0,21.0,3.2,6.5,1.6,4609,352,52.0,4.3,4.0,2.2,11.6,3.0,29.9,4.0,2.5,1.4,1463,255,53.2,11.5,2.7,2.5,11.2,5.9,18.5,7.9,14.4,6.1,2973,314,67.4,6.1,3.4,2.3,5.3,3.4,15.3,5.5,8.5,3.5,757,175,71.1,10.2,9.0,7.1,4.1,4.6,4.9,4.8,11.0,7.6,1014,238,79.6,10.0,1.2,2.0,2.8,2.9,12.9,8.7,3.6,3.2,4.4,(X),(X),(X),(X),(X),(X),(X),(X),(X),(X),(X)
0600000US0900305910,0900305910,"Bloomfield town, Hartford County, Connecticut",10482,384,58.5,4.1,2.4,1.1,16.1,2.9,17.7,2.8,5.3,1.7,4338,391,51.6,6.4,2.4,1.5,21.3,4.8,21.4,4.1,3.4,1.8,2043,252,51.5,7.9,2.7,3.0,15.0,5.8,25.1,7.0,5.6,3.4,2634,320,66.4,6.2,3.1,2.3,12.6,5.2,11.5,4.3,6.4,3.3,416,145,69.5,17.1,0.0,8.1,3.1,5.3,3.1,4.7,24.3,17.0,1051,234,76.3,9.2,1.3,2.1,10.3,6.7,9.7,6.1,2.4,2.7,6.9,(X),(X),(X),(X),(X),(X),(X),(X),(X),(X),(X)
0600000US0900308490,0900308490,"Bristol town, Hartford County, Connecticut",30966,815,72.7,1.7,2.2,0.6,7.1,0.9,13.6,1.4,4.4,0.7,10515,584,59.8,2.8,2.3,1.0,10.7,2.0,23.9,2.7,3.4,1.1,5444,522,66.1,5.2,2.7,1.6,7.7,2.5,17.0,3.7,6.6,2.2,8076,625,84.0,3.0,2.0,0.9,5.1,1.4,7.1,2.3,1.9,0.9,2615,331,67.7,5.4,4.6,2.3,3.2,2.9,7.0,3.4,17.6,5.2,4316,534,94.7,2.3,0.0,0.8,4.1,2.1,0.5,0.6,0.8,0.8,5.5,(X),(X),(X),(X),(X),(X),(X),(X),(X),(X),(X)
